
    =========================== USB Port2 ===========================

Connection Status        : 0x01 (Device is connected)
Port Chain               : 3-1-2
Properties               : 0x01
 IsUserConnectable       : yes
 PortIsDebugCapable      : no
 PortHasMultiCompanions  : no
 PortConnectorIsTypeC    : no

      ======================== USB Device ========================

        +++++++++++++++++ Device Information ++++++++++++++++++
Device Description       : USB Composite Device
Device Path              : \\?\usb#vid_1fc9&pid_818c#10#{a5dcbf10-6530-11d2-901f-00c04fb951ed}
Device ID                : USB\VID_1FC9&PID_818C\10
Hardware IDs             : USB\VID_1FC9&PID_818C&REV_0275 USB\VID_1FC9&PID_818C
Driver KeyName           : {36fc9e60-c465-11cf-8056-444553540000}\0008 (GUID_DEVCLASS_USB)
Driver                   : \SystemRoot\System32\drivers\usbccgp.sys (Version: 10.0.17134.1  Date: 2018-04-11)
Driver Inf               : C:\WINDOWS\inf\usb.inf
Legacy BusType           : PNPBus
Class                    : USB
Class GUID               : {36fc9e60-c465-11cf-8056-444553540000} (GUID_DEVCLASS_USB)
Interface GUID           : {a5dcbf10-6530-11d2-901f-00c04fb951ed} (GUID_DEVINTERFACE_USB_DEVICE)
Service                  : usbccgp
Enumerator               : USB
Location Info            : Port_#0002.Hub_#0005
Location IDs             : PCIROOT(0)#PCI(1D00)#USBROOT(0)#USB(1)#USB(2), ACPI(_SB_)#ACPI(PCI0)#ACPI(EHC1)#ACPI(HUBN)#ACPI(PR01)#ACPI(PR12)
Container ID             : {5e51a73f-6721-5bfb-8c14-5a44810d5ac1}
Manufacturer Info        : (Standard USB Host Controller)
Capabilities             : 0x94 (Removable, UniqueID, SurpriseRemovalOK)
Status                   : 0x0180600A (DN_DRIVER_LOADED, DN_STARTED, DN_DISABLEABLE, DN_REMOVABLE, DN_NT_ENUMERATOR, DN_NT_DRIVER)
Problem Code             : 0
Address                  : 2
Power State              : D0 (supported: D0, D3, wake from D0)
 Child Device 1          : Vindor (USB Audio Device)
  DevicePath             : \\?\usb#vid_1fc9&pid_818c&mi_00#7&34556303&2&0000#{6994ad04-93ef-11d0-a3cc-00a0c9223196}\global
  KernelName             : \Device\00000090\global
  Device ID              : USB\VID_1FC9&PID_818C&MI_00\7&34556303&2&0000
  Class                  : MEDIA
   Child Device 1        : Vindor [0] (Generic software device)
    DevicePath           : \\?\swd#mmdevapi#midii_220a90cb.p_0000#{6dc23320-ab33-4ce4-80d4-bbb3ebbf2814}
    KernelName           : \Device\00000094
    Device ID            : SWD\MMDEVAPI\MIDII_220A90CB.P_0000
    Class                : SoftwareDevice
   Child Device 2        : Vindor [1] (Generic software device)
    DevicePath           : \\?\swd#mmdevapi#midii_220a90cb.p_0001#{504be32c-ccf6-4d2c-b73f-6f8b3747e22b}
    KernelName           : \Device\00000095
    Device ID            : SWD\MMDEVAPI\MIDII_220A90CB.P_0001
    Class                : SoftwareDevice
 Child Device 2          : Vindor (USB Audio Device)
  DevicePath             : \\?\usb#vid_1fc9&pid_818c&mi_01#7&34556303&2&0001#{6994ad04-93ef-11d0-a3cc-00a0c9223196}\global
  KernelName             : \Device\00000091\global
  Device ID              : USB\VID_1FC9&PID_818C&MI_01\7&34556303&2&0001
  Class                  : MEDIA
   Child Device 1        : Digital Audio Interface (2- Vindor) (Audio Endpoint)
    DevicePath           : \\?\swd#mmdevapi#{0.0.0.00000000}.{3d8ef544-9988-441e-8868-ae851eafabb5}#{e6327cad-dcec-4949-ae8a-991e976a79d2}
    KernelName           : \Device\00000096
    Device ID            : SWD\MMDEVAPI\{0.0.0.00000000}.{3D8EF544-9988-441E-8868-AE851EAFABB5}
    Class                : AudioEndpoint
   Child Device 2        : Digital Audio Interface (2- Vindor) (Audio Endpoint)
    DevicePath           : \\?\swd#mmdevapi#{0.0.1.00000000}.{c21773c5-4e72-43b4-ab0d-0e6d69db09b6}#{2eef81be-33fa-4800-9670-1cd474972c3f}
    KernelName           : \Device\00000097
    Device ID            : SWD\MMDEVAPI\{0.0.1.00000000}.{C21773C5-4E72-43B4-AB0D-0E6D69DB09B6}
    Class                : AudioEndpoint

        +++++++++++++++++ Registry USB Flags +++++++++++++++++
HKEY_LOCAL_MACHINE\SYSTEM\CurrentControlSet\Control\UsbFlags\1FC9818C0275
 NewInterfaceUsage       : REG_DWORD 00000000 (0)

        ---------------- Connection Information ---------------
Connection Index         : 0x02 (2)
Connection Status        : 0x01 (DeviceConnected)
Current Config Value     : 0x01
Device Address           : 0x02 (2)
Is Hub                   : 0x00 (no)
Number Of Open Pipes     : 0x02 (2)
Device Bus Speed         : 0x01 (Full-Speed)
Pipe0ScheduleOffset      : 0x00 (0)
Pipe1ScheduleOffset      : 0x00 (0)
Data (HexDump)           : 02 00 00 00 12 01 10 01 EF 02 01 40 C9 1F 8C 81   ...........@....
                           75 02 01 02 03 01 01 01 00 02 00 02 00 00 00 01   u...............
                           00 00 00 09 05 02 02 40 00 00 00 00 00 00 09 05   .......@........
                           81 02 40 00 00 00 00 00 00                        ..@......

        --------------- Connection Information V2 -------------
Connection Index         : 0x02 (2)
Length                   : 0x10 (16 bytes)
SupportedUsbProtocols    : 0x03
 Usb110                  : 1 (yes)
 Usb200                  : 1 (yes)
 Usb300                  : 0 (no)
 ReservedMBZ             : 0x00
Flags                    : 0x00
 DevIsOpAtSsOrHigher     : 0 (Is not operating at SuperSpeed or higher)
 DevIsSsCapOrHigher      : 0 (Is not SuperSpeed capable or higher)
 DevIsOpAtSsPlusOrHigher : 0 (Is not operating at SuperSpeedPlus or higher)
 DevIsSsPlusCapOrHigher  : 0 (Is not SuperSpeedPlus capable or higher)
 ReservedMBZ             : 0x00
Data (HexDump)           : 02 00 00 00 10 00 00 00 03 00 00 00 00 00 00 00   ................

    ---------------------- Device Descriptor ----------------------
bLength                  : 0x12 (18 bytes)
bDescriptorType          : 0x01 (Device Descriptor)
bcdUSB                   : 0x110 (USB Version 1.10)
bDeviceClass             : 0xEF (Miscellaneous)
bDeviceSubClass          : 0x02
bDeviceProtocol          : 0x01 (IAD - Interface Association Descriptor)
bMaxPacketSize0          : 0x40 (64 bytes)
idVendor                 : 0x1FC9 (NXP Semiconductors)
idProduct                : 0x818C
bcdDevice                : 0x0275
iManufacturer            : 0x01 (String Descriptor 1)
 Language 0x0409         : "Vindor Music, Inc."
iProduct                 : 0x02 (String Descriptor 2)
 Language 0x0409         : "Vindor"
iSerialNumber            : 0x03 (String Descriptor 3)
 Language 0x0409         : "10"
bNumConfigurations       : 0x01 (1 Configuration)
Data (HexDump)           : 12 01 10 01 EF 02 01 40 C9 1F 8C 81 75 02 01 02   .......@....u...
                           03 01                                             ..

    ------------------ Configuration Descriptor -------------------
bLength                  : 0x09 (9 bytes)
bDescriptorType          : 0x02 (Configuration Descriptor)
wTotalLength             : 0x0113 (275 bytes)
bNumInterfaces           : 0x04 (4 Interfaces)
bConfigurationValue      : 0x01 (Configuration 1)
iConfiguration           : 0x00 (No String Descriptor)
bmAttributes             : 0xC0
 D7: Reserved, set 1     : 0x01
 D6: Self Powered        : 0x01 (yes)
 D5: Remote Wakeup       : 0x00 (no)
 D4..0: Reserved, set 0  : 0x00
MaxPower                 : 0x32 (100 mA)
Data (HexDump)           : 09 02 13 01 04 01 00 C0 32 09 04 00 00 02 01 03   ........2.......
                           00 00 07 24 01 00 01 25 00 06 24 02 01 01 00 06   ...$...%..$.....
                           24 02 02 02 00 09 24 03 01 03 01 02 01 00 09 24   $.....$........$
                           03 02 04 01 01 01 00 09 05 02 02 40 00 00 00 00   ...........@....
                           05 25 01 01 01 09 05 81 02 40 00 00 00 00 05 25   .%.......@.....%
                           01 01 03 08 0B 01 03 01 01 00 00 09 04 01 00 00   ................
                           01 01 00 00 0A 24 01 00 01 3E 00 02 02 03 0C 24   .....$...>.....$
                           02 01 02 06 00 02 03 00 00 00 09 24 03 02 01 01   ...........$....
                           00 01 00 0C 24 02 03 01 01 00 02 03 00 00 00 0A   ....$...........
                           24 06 31 03 01 01 02 02 00 09 24 03 04 02 06 00   $.1.......$.....
                           31 00 09 04 02 00 00 01 02 00 00 09 04 02 01 01   1...............
                           01 02 00 00 07 24 01 02 03 01 00 0B 24 02 01 02   .....$......$...
                           02 10 01 44 AC 00 09 05 83 09 B4 00 01 00 00 07   ...D............
                           25 01 00 00 00 00 09 04 03 00 00 01 02 00 00 09   %...............
                           04 03 01 02 01 02 00 00 07 24 01 03 03 01 00 0B   .........$......
                           24 02 01 02 02 10 01 44 AC 00 09 05 04 05 B4 00   $......D........
                           01 00 85 07 25 01 00 00 00 00 09 05 85 11 03 00   ....%...........
                           01 05 00                                          ...

        ---------------- Interface Descriptor -----------------
bLength                  : 0x09 (9 bytes)
bDescriptorType          : 0x04 (Interface Descriptor)
bInterfaceNumber         : 0x00
bAlternateSetting        : 0x00
bNumEndpoints            : 0x02 (2 Endpoints)
bInterfaceClass          : 0x01 (Audio)
bInterfaceSubClass       : 0x03 (MIDI Streaming)
bInterfaceProtocol       : 0x00
iInterface               : 0x00 (No String Descriptor)
Data (HexDump)           : 09 04 00 00 02 01 03 00 00                        .........

        - MIDI Adapter Class specific MS Interface Descriptor -
bLength                  : 0x07 (7 bytes)
bDescriptorType          : 0x24 (Class Specific Interface Descriptor)
bDescriptorSubtype       : 0x01 (MS Header)
bcdADC                   : 0x0100
wTotalLength             : 0x0025 (37 bytes)
Data (HexDump)           : 07 24 01 00 01 25 00 06 24 02 01 01 00 06 24 02   .$...%..$.....$.
                           02 02 00 09 24 03 01 03 01 02 01 00 09 24 03 02   ....$........$..
                           04 01 01 01 00                                    .....

        ---------------- MIDI IN Jack Descriptor --------------
bLength                  : 0x06 (6 bytes)
bDescriptorType          : 0x24 (Class Specific Interface Descriptor)
bDescriptorSubtype       : 0x02 (MIDI_IN_JACK)
bJackType                : 0x01 (Embedded)
bJackID                  : 0x01 (ID=1)
iJack                    : 0x00 (No String Descriptor)
Data (HexDump)           : 06 24 02 01 01 00                                 .$....

        ---------------- MIDI IN Jack Descriptor --------------
bLength                  : 0x06 (6 bytes)
bDescriptorType          : 0x24 (Class Specific Interface Descriptor)
bDescriptorSubtype       : 0x02 (MIDI_IN_JACK)
bJackType                : 0x02 (External)
bJackID                  : 0x02 (ID=2)
iJack                    : 0x00 (No String Descriptor)
Data (HexDump)           : 06 24 02 02 02 00                                 .$....

        --------------- MIDI OUT Jack Descriptor --------------
bLength                  : 0x09 (9 bytes)
bDescriptorType          : 0x24 (Class Specific Interface Descriptor)
bDescriptorSubtype       : 0x03 (MIDI_OUT_JACK)
bJackType                : 0x01 (Embedded)
bJackID                  : 0x03 (ID=3)
bNrInputPins             : 0x01 (1 pin)
baSourceID(1)            : 0x02 (input pin connected to entity ID=2)
baSourcePin(1)           : 0x01 (connected to input pin number 1
iJack                    : 0x00 (No String Descriptor)
Data (HexDump)           : 09 24 03 01 03 01 02 01 00                        .$.......

        --------------- MIDI OUT Jack Descriptor --------------
bLength                  : 0x09 (9 bytes)
bDescriptorType          : 0x24 (Class Specific Interface Descriptor)
bDescriptorSubtype       : 0x03 (MIDI_OUT_JACK)
bJackType                : 0x02 (External)
bJackID                  : 0x04 (ID=4)
bNrInputPins             : 0x01 (1 pin)
baSourceID(1)            : 0x01 (input pin connected to entity ID=1)
baSourcePin(1)           : 0x01 (connected to input pin number 1
iJack                    : 0x00 (No String Descriptor)
Data (HexDump)           : 09 24 03 02 04 01 01 01 00                        .$.......

        ----------------- Endpoint Descriptor -----------------
bLength                  : 0x09 (9 bytes)
bDescriptorType          : 0x05 (Endpoint Descriptor)
bEndpointAddress         : 0x02 (Direction=OUT EndpointID=2)
bmAttributes             : 0x02 (TransferType=Bulk)
wMaxPacketSize           : 0x0040 (64 bytes)
bInterval                : 0x00 (0 ms)
bRefresh                 : 0x00
bSynchAddress            : 0x00
Data (HexDump)           : 09 05 02 02 40 00 00 00 00                        ....@....

        --- Class-Specific MS Bulk Data Endpoint Descriptor ---
bLength                  : 0x05 (5 bytes)
bDescriptorType          : 0x25 (Audio Endpoint Descriptor)
bDescriptorSubtype       : 0x01 (MS General)
bNumEmbMIDIJack          : 0x01 (1 embedded MIDI jack)
baAssocJackID(1)         : 0x01 (Jack(1) ID=1)
Data (HexDump)           : 05 25 01 01 01                                    .%...

        ----------------- Endpoint Descriptor -----------------
bLength                  : 0x09 (9 bytes)
bDescriptorType          : 0x05 (Endpoint Descriptor)
bEndpointAddress         : 0x81 (Direction=IN EndpointID=1)
bmAttributes             : 0x02 (TransferType=Bulk)
wMaxPacketSize           : 0x0040 (64 bytes)
bInterval                : 0x00 (0 ms)
bRefresh                 : 0x00
bSynchAddress            : 0x00
Data (HexDump)           : 09 05 81 02 40 00 00 00 00                        ....@....

        --- Class-Specific MS Bulk Data Endpoint Descriptor ---
bLength                  : 0x05 (5 bytes)
bDescriptorType          : 0x25 (Audio Endpoint Descriptor)
bDescriptorSubtype       : 0x01 (MS General)
bNumEmbMIDIJack          : 0x01 (1 embedded MIDI jack)
baAssocJackID(1)         : 0x03 (Jack(1) ID=3)
Data (HexDump)           : 05 25 01 01 03                                    .%...

        ------------------- IAD Descriptor --------------------
bLength                  : 0x08 (8 bytes)
bDescriptorType          : 0x0B
bFirstInterface          : 0x01
bInterfaceCount          : 0x03
bFunctionClass           : 0x01 (Audio)
bFunctionSubClass        : 0x01 (Audio Control)
bFunctionProtocol        : 0x00
iFunction                : 0x00 (No String Descriptor)
Data (HexDump)           : 08 0B 01 03 01 01 00 00                           ........

        ---------------- Interface Descriptor -----------------
bLength                  : 0x09 (9 bytes)
bDescriptorType          : 0x04 (Interface Descriptor)
bInterfaceNumber         : 0x01
bAlternateSetting        : 0x00
bNumEndpoints            : 0x00 (Default Control Pipe only)
bInterfaceClass          : 0x01 (Audio)
bInterfaceSubClass       : 0x01 (Audio Control)
bInterfaceProtocol       : 0x00
iInterface               : 0x00 (No String Descriptor)
Data (HexDump)           : 09 04 01 00 00 01 01 00 00                        .........

        ------ Audio Control Interface Header Descriptor ------
bLength                  : 0x0A (10 bytes)
bDescriptorType          : 0x24 (Audio Interface Descriptor)
bDescriptorSubtype       : 0x01 (Header)
bcdADC                   : 0x0100
wTotalLength             : 0x003E (62 bytes)
bInCollection            : 0x02
baInterfaceNr[1]         : 0x02
baInterfaceNr[2]         : 0x03
Data (HexDump)           : 0A 24 01 00 01 3E 00 02 02 03                     .$...>....

        ------- Audio Control Input Terminal Descriptor -------
bLength                  : 0x0C (12 bytes)
bDescriptorType          : 0x24 (Audio Interface Descriptor)
bDescriptorSubtype       : 0x02 (Input Terminal)
bTerminalID              : 0x01
wTerminalType            : 0x0602 (Digital audio interface)
bAssocTerminal           : 0x00
bNrChannels              : 0x02
wChannelConfig           : 0x0003
iChannelNames            : 0x00 (No String Descriptor)
iTerminal                : 0x00 (No String Descriptor)
Data (HexDump)           : 0C 24 02 01 02 06 00 02 03 00 00 00               .$..........

        ------- Audio Control Output Terminal Descriptor ------
bLength                  : 0x09 (9 bytes)
bDescriptorType          : 0x24 (Audio Interface Descriptor)
bDescriptorSubtype       : 0x03 (Output Terminal)
bTerminalID              : 0x02
wTerminalType            : 0x0101 (USB streaming)
bAssocTerminal           : 0x00 (0)
bSourceID                : 0x01 (1)
iTerminal                : 0x00 (No String Descriptor)
Data (HexDump)           : 09 24 03 02 01 01 00 01 00                        .$.......

        ------- Audio Control Input Terminal Descriptor -------
bLength                  : 0x0C (12 bytes)
bDescriptorType          : 0x24 (Audio Interface Descriptor)
bDescriptorSubtype       : 0x02 (Input Terminal)
bTerminalID              : 0x03
wTerminalType            : 0x0101 (USB streaming)
bAssocTerminal           : 0x00
bNrChannels              : 0x02
wChannelConfig           : 0x0003
iChannelNames            : 0x00 (No String Descriptor)
iTerminal                : 0x00 (No String Descriptor)
Data (HexDump)           : 0C 24 02 03 01 01 00 02 03 00 00 00               .$..........

        -------- Audio Control Feature Unit Descriptor --------
bLength                  : 0x0A (10 bytes)
bDescriptorType          : 0x24 (Audio Interface Descriptor)
bDescriptorSubtype       : 0x06 (Feature Unit)
bUnitID                  : 0x31 (49)
bSourceID                : 0x03 (3)
bControlSize             : 0x01 (1 byte per control)
bmaControls[0]           : 0x01
 D0: Mute                : 1
 D1: Volume              : 0
 D2: Bass                : 0
 D3: Mid                 : 0
 D4: Treble              : 0
 D5: Graphic Equalizer   : 0
 D6: Automatic Gain      : 0
 D7: Delay               : 0
bmaControls[1]           : 0x02
 D0: Mute                : 0
 D1: Volume              : 1
 D2: Bass                : 0
 D3: Mid                 : 0
 D4: Treble              : 0
 D5: Graphic Equalizer   : 0
 D6: Automatic Gain      : 0
 D7: Delay               : 0
bmaControls[2]           : 0x02
 D0: Mute                : 0
 D1: Volume              : 1
 D2: Bass                : 0
 D3: Mid                 : 0
 D4: Treble              : 0
 D5: Graphic Equalizer   : 0
 D6: Automatic Gain      : 0
 D7: Delay               : 0
iFeature                 : 0x00 (No String Descriptor)
Data (HexDump)           : 0A 24 06 31 03 01 01 02 02 00                     .$.1......

        ------- Audio Control Output Terminal Descriptor ------
bLength                  : 0x09 (9 bytes)
bDescriptorType          : 0x24 (Audio Interface Descriptor)
bDescriptorSubtype       : 0x03 (Output Terminal)
bTerminalID              : 0x04
wTerminalType            : 0x0602 (Digital audio interface)
bAssocTerminal           : 0x00 (0)
bSourceID                : 0x31 (49)
iTerminal                : 0x00 (No String Descriptor)
Data (HexDump)           : 09 24 03 04 02 06 00 31 00                        .$.....1.

        ---------------- Interface Descriptor -----------------
bLength                  : 0x09 (9 bytes)
bDescriptorType          : 0x04 (Interface Descriptor)
bInterfaceNumber         : 0x02
bAlternateSetting        : 0x00
bNumEndpoints            : 0x00 (Default Control Pipe only)
bInterfaceClass          : 0x01 (Audio)
bInterfaceSubClass       : 0x02 (Audio Streaming)
bInterfaceProtocol       : 0x00
iInterface               : 0x00 (No String Descriptor)
Data (HexDump)           : 09 04 02 00 00 01 02 00 00                        .........

        ---------------- Interface Descriptor -----------------
bLength                  : 0x09 (9 bytes)
bDescriptorType          : 0x04 (Interface Descriptor)
bInterfaceNumber         : 0x02
bAlternateSetting        : 0x01
bNumEndpoints            : 0x01 (1 Endpoint)
bInterfaceClass          : 0x01 (Audio)
bInterfaceSubClass       : 0x02 (Audio Streaming)
bInterfaceProtocol       : 0x00
iInterface               : 0x00 (No String Descriptor)
Data (HexDump)           : 09 04 02 01 01 01 02 00 00                        .........

        -------- Audio Streaming Interface Descriptor ---------
bLength                  : 0x07 (7 bytes)
bDescriptorType          : 0x24 (Audio Interface Descriptor)
bDescriptorSubtype       : 0x01
bTerminalLink            : 0x02
bDelay                   : 0x03
wFormatTag               : 0x0001 (PCM)
Data (HexDump)           : 07 24 01 02 03 01 00                              .$.....

        ------- Audio Streaming Format Type Descriptor --------
bLength                  : 0x0B (11 bytes)
bDescriptorType          : 0x24 (Audio Interface Descriptor)
bDescriptorSubtype       : 0x02 (Format Type)
bFormatType              : 0x01
bNrChannels              : 0x02 (2 channels)
bSubframeSize            : 0x02 (2 bytes per subframe)
bBitResolution           : 0x10 (16 bits per sample)
bSamFreqType             : 0x01 (supports 1 sample frequence)
tSamFreq[1]              : 0x0AC44 (44100 Hz)
Data (HexDump)           : 0B 24 02 01 02 02 10 01 44 AC 00                  .$......D..

        ----------------- Endpoint Descriptor -----------------
bLength                  : 0x09 (9 bytes)
bDescriptorType          : 0x05 (Endpoint Descriptor)
bEndpointAddress         : 0x83 (Direction=IN EndpointID=3)
bmAttributes             : 0x09 (TransferType=Isochronous  SyncType=Adaptive  EndpointType=Data)
wMaxPacketSize           : 0x00B4 (180 bytes)
bInterval                : 0x01 (1 ms)
bRefresh                 : 0x00
bSynchAddress            : 0x00
Data (HexDump)           : 09 05 83 09 B4 00 01 00 00                        .........

        ----------- Audio Data Endpoint Descriptor ------------
bLength                  : 0x07 (7 bytes)
bDescriptorType          : 0x25 (Audio Endpoint Descriptor)
bDescriptorSubtype       : 0x01 (General)
bmAttributes             : 0x00
bLockDelayUnits          : 0x00
wLockDelay               : 0x0000
Data (HexDump)           : 07 25 01 00 00 00 00                              .%.....

        ---------------- Interface Descriptor -----------------
bLength                  : 0x09 (9 bytes)
bDescriptorType          : 0x04 (Interface Descriptor)
bInterfaceNumber         : 0x03
bAlternateSetting        : 0x00
bNumEndpoints            : 0x00 (Default Control Pipe only)
bInterfaceClass          : 0x01 (Audio)
bInterfaceSubClass       : 0x02 (Audio Streaming)
bInterfaceProtocol       : 0x00
iInterface               : 0x00 (No String Descriptor)
Data (HexDump)           : 09 04 03 00 00 01 02 00 00                        .........

        ---------------- Interface Descriptor -----------------
bLength                  : 0x09 (9 bytes)
bDescriptorType          : 0x04 (Interface Descriptor)
bInterfaceNumber         : 0x03
bAlternateSetting        : 0x01
bNumEndpoints            : 0x02 (2 Endpoints)
bInterfaceClass          : 0x01 (Audio)
bInterfaceSubClass       : 0x02 (Audio Streaming)
bInterfaceProtocol       : 0x00
iInterface               : 0x00 (No String Descriptor)
Data (HexDump)           : 09 04 03 01 02 01 02 00 00                        .........

        -------- Audio Streaming Interface Descriptor ---------
bLength                  : 0x07 (7 bytes)
bDescriptorType          : 0x24 (Audio Interface Descriptor)
bDescriptorSubtype       : 0x01
bTerminalLink            : 0x03
bDelay                   : 0x03
wFormatTag               : 0x0001 (PCM)
Data (HexDump)           : 07 24 01 03 03 01 00                              .$.....

        ------- Audio Streaming Format Type Descriptor --------
bLength                  : 0x0B (11 bytes)
bDescriptorType          : 0x24 (Audio Interface Descriptor)
bDescriptorSubtype       : 0x02 (Format Type)
bFormatType              : 0x01
bNrChannels              : 0x02 (2 channels)
bSubframeSize            : 0x02 (2 bytes per subframe)
bBitResolution           : 0x10 (16 bits per sample)
bSamFreqType             : 0x01 (supports 1 sample frequence)
tSamFreq[1]              : 0x0AC44 (44100 Hz)
Data (HexDump)           : 0B 24 02 01 02 02 10 01 44 AC 00                  .$......D..

        ----------------- Endpoint Descriptor -----------------
bLength                  : 0x09 (9 bytes)
bDescriptorType          : 0x05 (Endpoint Descriptor)
bEndpointAddress         : 0x04 (Direction=OUT EndpointID=4)
bmAttributes             : 0x05 (TransferType=Isochronous  SyncType=Asynchronous  EndpointType=Data)
wMaxPacketSize           : 0x00B4 (180 bytes)
bInterval                : 0x01 (1 ms)
bRefresh                 : 0x00
bSynchAddress            : 0x85 (Direction=IN EndpointID=5)
Data (HexDump)           : 09 05 04 05 B4 00 01 00 85                        .........

        ----------- Audio Data Endpoint Descriptor ------------
bLength                  : 0x07 (7 bytes)
bDescriptorType          : 0x25 (Audio Endpoint Descriptor)
bDescriptorSubtype       : 0x01 (General)
bmAttributes             : 0x00
bLockDelayUnits          : 0x00
wLockDelay               : 0x0000
Data (HexDump)           : 07 25 01 00 00 00 00                              .%.....

        ----------------- Endpoint Descriptor -----------------
bLength                  : 0x09 (9 bytes)
bDescriptorType          : 0x05 (Endpoint Descriptor)
bEndpointAddress         : 0x85 (Direction=IN EndpointID=5)
bmAttributes             : 0x11 (TransferType=Isochronous  SyncType=None  EndpointType=Feedback)
wMaxPacketSize           : 0x0003 (3 bytes)
bInterval                : 0x01 (1 ms)
bRefresh                 : 0x05 (32 ms)
bSynchAddress            : 0x00
Data (HexDump)           : 09 05 85 11 03 00 01 05 00                        .........

      -------------------- String Descriptors -------------------
             ------ String Descriptor 0 ------
bLength                  : 0x04 (4 bytes)
bDescriptorType          : 0x03 (String Descriptor)
Language ID[0]           : 0x0409 (English - United States)
Data (HexDump)           : 04 03 09 04                                       ....
             ------ String Descriptor 1 ------
bLength                  : 0x26 (38 bytes)
bDescriptorType          : 0x03 (String Descriptor)
Language 0x0409          : "Vindor Music, Inc."
Data (HexDump)           : 26 03 56 00 69 00 6E 00 64 00 6F 00 72 00 20 00   &.V.i.n.d.o.r. .
                           4D 00 75 00 73 00 69 00 63 00 2C 00 20 00 49 00   M.u.s.i.c.,. .I.
                           6E 00 63 00 2E 00                                 n.c...
             ------ String Descriptor 2 ------
bLength                  : 0x0E (14 bytes)
bDescriptorType          : 0x03 (String Descriptor)
Language 0x0409          : "Vindor"
Data (HexDump)           : 0E 03 56 00 69 00 6E 00 64 00 6F 00 72 00         ..V.i.n.d.o.r.
             ------ String Descriptor 3 ------
bLength                  : 0x06 (6 bytes)
bDescriptorType          : 0x03 (String Descriptor)
Language 0x0409          : "10"
Data (HexDump)           : 06 03 31 00 30 00                                 ..1.0.
